[
  {
    "topic_id": "TOP-001",
    "topic": "Consent",
    "dpdpa_com": "yes",
    "saralprivacy": "yes",
    "primary_evidence": "yes",
    "gap": "none",
    "competitor_urls": [
      "https://www.dpdpa.com/blog.html",
      "https://www.dpdpa.com/blogs/Challenges_Implications_of_india's_dpdpa.html",
      "https://www.dpdpa.com/blogs/DPDP Rules 2025- Analysis of Industry implications.html",
      "https://www.dpdpa.com/blogs/DPDPA_Implementation_Timeline.html",
      "https://www.dpdpa.com/blogs/Detecting_and_Monitoring_Unauthorized_Use_of_Personal_Data.html",
      "https://www.dpdpa.com/blogs/Impact of India's DPDPA on AI with Examples and Global Comparisons.html",
      "https://www.dpdpa.com/blogs/Privacy_in_India_Was_it_There_Will_It_Be_There.html",
      "https://www.dpdpa.com/blogs/The_DPDPA_Conundrum_for_Indian_SMEs.html"
    ],
    "saralprivacy_evidence": [
      "DPDPA 2023 Section 6",
      "SaralPrivacy MSME guide / Bible / seed KOs"
    ],
    "primary_citation": "DPDPA 2023 Section 6",
    "note": "Competitor hits=142 across 106 pages; SaralPrivacy hits=158.",
    "publication_eligible": false
  },
  {
    "topic_id": "TOP-002",
    "topic": "Notice",
    "dpdpa_com": "yes",
    "saralprivacy": "yes",
    "primary_evidence": "yes",
    "gap": "none",
    "competitor_urls": [
      "https://www.dpdpa.com/blogs/DPDP Rules 2025- Analysis of Industry implications.html",
      "https://www.dpdpa.com/blogs/DPDPA_Implementation_Timeline.html",
      "https://www.dpdpa.com/blogs/Detecting_and_Monitoring_Unauthorized_Use_of_Personal_Data.html",
      "https://www.dpdpa.com/blogs/The_DPDPA_Conundrum_for_Indian_SMEs.html",
      "https://www.dpdpa.com/blogs/Understanding_Role_of_a_Consent_Manager_Under_DPDPA_and_DPDP_Rules.html",
      "https://www.dpdpa.com/blogs/childrens_of_illiterate_parents_banned_from_social_media.html",
      "https://www.dpdpa.com/blogs/dataprincipalrightsunderdpdpa.html",
      "https://www.dpdpa.com/blogs/dpdpa_banks_nbfcs_financial_data_protection.html"
    ],
    "saralprivacy_evidence": [
      "DPDPA 2023 Section 5",
      "SaralPrivacy MSME guide / Bible / seed KOs"
    ],
    "primary_citation": "DPDPA 2023 Section 5",
    "note": "Competitor hits=55 across 45 pages; SaralPrivacy hits=50.",
    "publication_eligible": false
  },
  {
    "topic_id": "TOP-003",
    "topic": "Children",
    "dpdpa_com": "yes",
    "saralprivacy": "yes",
    "primary_evidence": "yes",
    "gap": "none",
    "competitor_urls": [
      "https://www.dpdpa.com/blogs/DPDPA_Implementation_Timeline.html",
      "https://www.dpdpa.com/blogs/childrens_of_illiterate_parents_banned_from_social_media.html",
      "https://www.dpdpa.com/blogs/demystifying_dpia_in_dpdpa.html",
      "https://www.dpdpa.com/blogs/dpdpa_edtech_platforms_student_data_protection.html",
      "https://www.dpdpa.com/blogs/gdpr_vs_dpdpa_vs_ccpa_comprehensive_comparison.html",
      "https://www.dpdpa.com/blogs/opportunities_small_business_dpdpa.html",
      "https://www.dpdpa.com/blogs/righttonominatedpdpadigitalafterlife.html",
      "https://www.dpdpa.com/blogs/vendor_data_processing_agreement_dpa_dpdpa_template.html"
    ],
    "saralprivacy_evidence": [
      "DPDPA 2023 Section 9",
      "SaralPrivacy MSME guide / Bible / seed KOs"
    ],
    "primary_citation": "DPDPA 2023 Section 9",
    "note": "Competitor hits=36 across 29 pages; SaralPrivacy hits=80.",
    "publication_eligible": false
  },
  {
    "topic_id": "TOP-004",
    "topic": "Legitimate uses",
    "dpdpa_com": "yes",
    "saralprivacy": "yes",
    "primary_evidence": "yes",
    "gap": "none",
    "competitor_urls": [
      "https://www.dpdpa.com/blogs/Challenges_Implications_of_india's_dpdpa.html",
      "https://www.dpdpa.com/blogs/DPDP Rules 2025- Analysis of Industry implications.html",
      "https://www.dpdpa.com/blogs/chatgpt_generative_ai_dpdpa_data_protection_risks.html",
      "https://www.dpdpa.com/blogs/consent_management_platform_cmp_dpdpa_selection_guide.html",
      "https://www.dpdpa.com/blogs/data_protection_audit_dpdpa_sdf_requirements.html",
      "https://www.dpdpa.com/blogs/gdpr_judgements_dpbi_india_learnings.html",
      "https://www.dpdpa.com/postersofdpdpa.html",
      "https://www.dpdpa.com/dpdpa-certificate-course.html"
    ],
    "saralprivacy_evidence": [
      "DPDPA 2023 Section 7",
      "SaralPrivacy MSME guide / Bible / seed KOs"
    ],
    "primary_citation": "DPDPA 2023 Section 7",
    "note": "Competitor hits=31 across 18 pages; SaralPrivacy hits=31.",
    "publication_eligible": false
  },
  {
    "topic_id": "TOP-005",
    "topic": "Data Fiduciary obligations",
    "dpdpa_com": "yes",
    "saralprivacy": "yes",
    "primary_evidence": "yes",
    "gap": "none",
    "competitor_urls": [
      "https://www.dpdpa.com/blogs/dataerasureandcertificationunderdpdpa.html",
      "https://www.dpdpa.com/blogs/dpdpa_compliance_checklist_2026_business_assessment.html",
      "https://www.dpdpa.com/blogs/dpdpa_compliant_privacy_policy_template_guide.html",
      "https://www.dpdpa.com/blogs/significant_data_fiduciary_sdf_dpdpa_guide.html",
      "https://www.dpdpa.com/dpdpa2023/chapter-2/section10.html",
      "https://www.dpdpa.com/dpdpa2023/chapter-2/section8.html",
      "https://www.dpdpa.com/dpdparules/rule13.html"
    ],
    "saralprivacy_evidence": [
      "DPDPA 2023 Section 8",
      "SaralPrivacy MSME guide / Bible / seed KOs"
    ],
    "primary_citation": "DPDPA 2023 Section 8",
    "note": "Competitor hits=8 across 7 pages; SaralPrivacy hits=75.",
    "publication_eligible": false
  },
  {
    "topic_id": "TOP-006",
    "topic": "Data mapping / inventory",
    "dpdpa_com": "no",
    "saralprivacy": "yes",
    "primary_evidence": "yes",
    "gap": "sp_advantage",
    "competitor_urls": [],
    "saralprivacy_evidence": [
      "DPDPA 2023 Section 4 / Section 8",
      "SaralPrivacy MSME guide / Bible / seed KOs"
    ],
    "primary_citation": "DPDPA 2023 Section 4 / Section 8",
    "note": "Competitor hits=0 across 0 pages; SaralPrivacy hits=11.",
    "publication_eligible": false
  },
  {
    "topic_id": "TOP-007",
    "topic": "DPIA",
    "dpdpa_com": "yes",
    "saralprivacy": "yes",
    "primary_evidence": "yes",
    "gap": "differentiate",
    "competitor_urls": [
      "https://www.dpdpa.com/blogs/blog1.html",
      "https://www.dpdpa.com/blogs/blog2.html",
      "https://www.dpdpa.com/blogs/cookie_scanner_compliance.html",
      "https://www.dpdpa.com/blogs/data_protection_officer_dpo_dpdpa_qualifications.html",
      "https://www.dpdpa.com/blogs/databreachreporting.html",
      "https://www.dpdpa.com/blogs/demystifying_dpia_in_dpdpa.html",
      "https://www.dpdpa.com/blogs/gdpr_vs_dpdpa_vs_ccpa_comprehensive_comparison.html",
      "https://www.dpdpa.com/blogs/india_eu_data_adequacy_dpdpa_gdpr.html"
    ],
    "saralprivacy_evidence": [
      "DPDPA 2023 Section 10",
      "SaralPrivacy MSME guide / Bible / seed KOs"
    ],
    "primary_citation": "DPDPA 2023 Section 10",
    "note": "Competitor hits=26 across 22 pages; SaralPrivacy hits=11.",
    "publication_eligible": false
  },
  {
    "topic_id": "TOP-008",
    "topic": "Significant Data Fiduciary",
    "dpdpa_com": "yes",
    "saralprivacy": "yes",
    "primary_evidence": "yes",
    "gap": "none",
    "competitor_urls": [
      "https://www.dpdpa.com/blog.html",
      "https://www.dpdpa.com/blogs/DPDPA_Implementation_Timeline.html",
      "https://www.dpdpa.com/blogs/data_protection_audit_dpdpa_sdf_requirements.html",
      "https://www.dpdpa.com/blogs/data_protection_officer_dpo_dpdpa_qualifications.html",
      "https://www.dpdpa.com/blogs/significant_data_fiduciary_sdf_dpdpa_guide.html",
      "https://www.dpdpa.com/dpdpa-certificate-course.html",
      "https://www.dpdpa.com/dpdpa-module-3.html",
      "https://www.dpdpa.com/dpdpa2023/chapter-1/section2.html"
    ],
    "saralprivacy_evidence": [
      "DPDPA 2023 Section 10",
      "SaralPrivacy MSME guide / Bible / seed KOs"
    ],
    "primary_citation": "DPDPA 2023 Section 10",
    "note": "Competitor hits=18 across 15 pages; SaralPrivacy hits=30.",
    "publication_eligible": false
  },
  {
    "topic_id": "TOP-009",
    "topic": "Consent Manager",
    "dpdpa_com": "yes",
    "saralprivacy": "yes",
    "primary_evidence": "yes",
    "gap": "none",
    "competitor_urls": [
      "https://www.dpdpa.com/blogs/DPDP Rules 2025- Analysis of Industry implications.html",
      "https://www.dpdpa.com/blogs/DPDPA_Implementation_Timeline.html",
      "https://www.dpdpa.com/blogs/Understanding_Role_of_a_Consent_Manager_Under_DPDPA_and_DPDP_Rules.html",
      "https://www.dpdpa.com/blogs/consent_management_platform_cmp_dpdpa_selection_guide.html",
      "https://www.dpdpa.com/blogs/gdpr_judgements_dpbi_india_learnings.html",
      "https://www.dpdpa.com/blogs/righttonominatedpdpadigitalafterlife.html",
      "https://www.dpdpa.com/",
      "https://www.dpdpa.com/blogs"
    ],
    "saralprivacy_evidence": [
      "DPDPA 2023 Section 2; Rules on registration",
      "SaralPrivacy MSME guide / Bible / seed KOs"
    ],
    "primary_citation": "DPDPA 2023 Section 2; Rules on registration",
    "note": "Competitor hits=19 across 18 pages; SaralPrivacy hits=22.",
    "publication_eligible": false
  },
  {
    "topic_id": "TOP-010",
    "topic": "Breach response",
    "dpdpa_com": "yes",
    "saralprivacy": "yes",
    "primary_evidence": "yes",
    "gap": "none",
    "competitor_urls": [
      "https://www.dpdpa.com/blog.html",
      "https://www.dpdpa.com/blogs/DPDPA_Implementation_Timeline.html",
      "https://www.dpdpa.com/blogs/Detecting_and_Monitoring_Unauthorized_Use_of_Personal_Data.html",
      "https://www.dpdpa.com/blogs/Understanding_Role_of_a_Consent_Manager_Under_DPDPA_and_DPDP_Rules.html",
      "https://www.dpdpa.com/blogs/chatgpt_generative_ai_dpdpa_data_protection_risks.html",
      "https://www.dpdpa.com/blogs/compensation_for_victims_of_data_breach_under_dpdpa.html",